{
  "skill_id": "options.greeks",
  "version": "1.0.0",
  "name": "Options Greeks",
  "description": "Compute model-explicit option greeks from supplied inputs.",
  "source_classes": ["computed"],
  "runtime": {
    "profile": "interactive",
    "image": "registry.digitalocean.com/doomberg/doomberg:latest",
    "cpu": 0.25,
    "memory_mb": 256,
    "timeout_seconds": 30
  },
  "permissions": {
    "datasets": [],
    "broker": [],
    "network": []
  },
  "input_schema": {
    "type": "object"
  },
  "output_schema": {
    "type": "object"
  },
  "freshness_requirement_seconds": null,
  "trigger_compatible": true,
  "determinism": "deterministic",
  "artifact_types": [],
  "deprecated": false
}
